"GO.ID","Term","Annotated","Significant","Expected","Rank in classicFisher","classicFisher","classicKS","elimKS"
"GO:0009987","cellular process",19,19,19,1,"1","0.060","0.060"
"GO:0006725","cellular aromatic compound metabolic pro...",9,9,9,2,"1","0.093","0.093"
"GO:0046483","heterocycle metabolic process",9,9,9,3,"1","0.093","0.093"
"GO:1901360","organic cyclic compound metabolic proces...",9,9,9,4,"1","0.093","0.093"
"GO:0006807","nitrogen compound metabolic process",13,13,13,5,"1","0.121","0.121"
