"GO.ID","Term","Annotated","Significant","Expected","Rank in classicFisher","classicFisher","classicKS","elimKS"
"GO:0055114","oxidation-reduction process",143,100,77.4,1,"5.3e-05","2.5e-08","2.5e-08"
"GO:0043094","cellular metabolic compound salvage",8,7,4.33,60,"0.0570","0.00037","0.00037"
"GO:0034754","cellular hormone metabolic process",6,5,3.25,148,"0.1527","0.00081","0.00081"
"GO:0000070","mitotic sister chromatid segregation",15,14,8.12,4,"0.0013","0.00250","0.00250"
"GO:0000097","sulfur amino acid biosynthetic process",4,4,2.16,83,"0.0856","0.00405","0.00405"
