"GO.ID","Term","Annotated","Significant","Expected","Rank in classicFisher","classicFisher","classicKS","elimKS"
"GO:0006030","chitin metabolic process",34,28,15.96,4,"2.1e-05","3.9e-06","3.9e-06"
"GO:0015986","ATP synthesis coupled proton transport",11,11,5.16,14,"0.00024","0.00011","0.00011"
"GO:0001736","establishment of planar polarity",14,12,6.57,42,"0.00328","0.00039","0.00039"
"GO:0007156","homophilic cell adhesion via plasma memb...",14,10,6.57,191,"0.05728","0.00136","0.00136"
"GO:0021543","pallium development",10,9,4.69,50,"0.00630","0.00143","0.00143"
